{
  "protocolVersion": 1,
  "runId": "9aae3f23c0e34c768b7c5c60cf008bbe",
  "requestGeneration": 0,
  "stepId": "scene-scan.report-options",
  "schemaHash": "4bbaa61e9bf8a2e2664d3b9cf98944711aa26d5c714e911044298193f08a14cb",
  "accepted": true,
  "values": {
    "includeInactive": false,
    "detailMode": "summary",
    "topComponentCount": 10
  }
}